{
  "schemaVersion": "1",
  "nonce": "test_nonce_1234567890_abcdefghijklmnop",
  "deviceId": "11111111-1111-4111-8111-111111111111",
  "installationId": "22222222-2222-4222-8222-222222222222",
  "publicKeyFingerprint": "sha256:aaaaaaaaaaaaaaaaaaaaaaaaaaaaaaaaaaaaaaaaaaaaaaaaaaaaaaaaaaaaaaaa",
  "architecture": "linux/amd64",
  "coreVersion": "0.1.0",
  "issuedAt": "2026-07-19T12:00:00Z",
  "expiresAt": "2026-07-19T12:05:00Z"
}
